{
  "schema_version": 1,
  "record_type": "worker-approval",
  "approval_id": "approve-runtime-investigator-r3",
  "worker_id": "runtime-investigator",
  "worker_name": "小林（运行时排查）",
  "registry_id": "project-workers",
  "registry_revision": 3,
  "worker_digest": "aaaaaaaaaaaaaaaaaaaaaaaaaaaaaaaaaaaaaaaaaaaaaaaaaaaaaaaaaaaaaaaa",
  "approved_at": "2026-09-12T10:00:00+08:00",
  "approved_by": "old-zhou/example"
}
